action_id,action_name,current_place,target_place,why,effect
A-001,Собрать диагностику,отдельный launcher entry рядом с send results,главная команда shell + стартовый экран Diagnostics,это главный diagnostics-route по канону,"пользователь понимает, с чего начинать диагностику"
A-002,Отправить результаты,отдельное top-level окно,второй шаг внутри Diagnostics после готового bundle,"это не первый маршрут, а продолжение диагностики",исчезает раздвоение diagnostics-route
A-003,Быстрое сравнение,"и embedded, и viewer без иерархии",внутри Анализа как основной compare,пользователю нужен один основной compare-path,снижается конкуренция compare routes
A-004,Подробное сравнение,отдельный Compare Viewer без ясной роли,advanced action из Анализа,viewer нужен как расширенный режим,viewer перестаёт спорить с embedded compare
A-005,Запустить Animator,сильная отдельная кнопка рядом с разными окнами,следующий шаг после Анализа/подробного прогона,"анимация — не стартовая задача, а просмотр результата",маршрут становится линейнее
A-006,Открыть Mnemo,отдельная кнопка на старте,advanced action из Анализа или Инструментов,мнемосхема важна не всем пользователям сразу,уменьшается стартовая перегрузка
A-007,Открыть Desktop Tools Center,почти равноправная стартовая кнопка,вторичный раздел Инструменты,"это service-hub, а не шаг основного маршрута",главный экран перестаёт быть каталогом утилит
